{
 "format": "spyder-bone/engine_check",
 "format_version": 1,
 "check": "c1",
 "id": "check.c1",
 "version": "3.0.1",
 "engine_min": "1.1",
 "status": "active",
 "title": "C1: generic foreign organic (C-H excess over the collagen line, or an organic film)",
 "description": "excess = (r1728 + r1762 + r2262 + r2350) - (a + b x (r1510 + r2044 + r2175)), r = mean E (evidence kernel) over centre +- 2 nm. Fires if excess > the cut. Full variant only: film = mean E over peak_nm +- half_width_nm minus mean E over trough_nm +- half_width_nm (the 2298/2325 organic-film contrast); C1 also fires if film >= its cut (record: film, film_fired; null where the film rule does not run). Runs only when no plaster, wax or ester sign fired and C1 passes its B6b gate; when the long-wave tail is unreliable for C1 (check.longwave) the truncated variant runs. When C1 is gated and check.acquisition lists a fallback, the swir1 variant (1728 + 1762 over 1510 nm only, no film rule, no soft line) runs instead. Adds a flag; blocks an evidence lift. soft_tier: the soft line of the 'possible thin coating' note (check.signs soft_tier), full and truncated.",
 "licence": "CC-BY-4.0",
 "created": "2026-10-03",
 "provenance": {
  "basis": "Phase 0a A5: (a, b) least squares on 1,201 clean bone scans (public reference bones and unreleased archaeological fauna; statistics only); cut = 99.5th percentile of the specimen-grouped out-of-fold excess (8.00), rounded. False alarms 6/1,201 (0.50%) out of fold; held out across sources 0.30-0.80%.",
  "film": "DECISIONS 100-103 (2026-10-05): the 2298/2325 contrast separates C-H-combination-heavy coatings from bone (report 11 section 11.5). Cut 17.8 = the 99.5th percentile of 2,322 clean standard-res scans (8 sets; pre-registered rule: <= 1% pooled, <= 2% per set): 0.5% pooled, worst set 1.6%. Adds 14 of 715 coated scans the shipped signs miss, mostly Butvar (museum 30% -> 53%), for 0.4% extra clean false alarms. Not in the truncated variant (the > 2300 nm region is too noisy then).",
  "swir1": "2026-10-13 (pre-registered; planning hires_fallback): (a, b) least squares on the 1,201 clean scans; cut 10.8 = 1.1 x the largest clean value seen in the high-resolution study sets (out-of-fold 99.5th percentile 7.2 gave 5% false alarms on one dark set). 0 of 2,322 clean standard-resolution scans (8 sets) exceed it. On real coated standard-resolution scans it catches far less than the full signs (film rule included): alkyd 34% vs 85%, glued fauna 22% vs 88%, PVAc 3% vs 65%, museum Butvar 0% vs 47%: a reduced check for heavy consolidants, used only where the full C1 cannot run."
 },
 "parameters": {
  "kernel": {
   "absorbance_clip": 1e-06,
   "savgol": {
    "window": 31,
    "polyorder": 3,
    "deriv": 2,
    "delta": 1.0,
    "mode": "interp"
   },
   "scale": -100000.0
  },
  "read_half_width_nm": 2,
  "ch_bands_nm": [
   1728,
   1762,
   2262,
   2350
  ],
  "nh_bands_nm": [
   1510,
   2044,
   2175
  ],
  "a": 2.048979435668694,
  "b": 0.7237030866308519,
  "fires_if_excess_above": 8.0,
  "film": {
   "peak_nm": 2299,
   "trough_nm": 2325,
   "half_width_nm": 3,
   "fires_if_at_least": 17.8
  },
  "runs_only_if_not_fired": [
   "plaster",
   "wax",
   "ester"
  ],
  "gate": "B6b",
  "soft_tier": {
   "excess_at_least": 6.6
  },
  "truncated": {
   "ch_bands_nm": [
    1728,
    1762,
    2262
   ],
   "nh_bands_nm": [
    1510,
    2044,
    2175
   ],
   "a": 3.7984583230957534,
   "b": 0.6310989707028958,
   "fires_if_excess_above": 7.5,
   "soft_tier": {
    "excess_at_least": 6.1
   },
   "derivation": "same construction without r2350 (least squares on the clean pool; T = rounded 99.5th percentile of the grouped out-of-fold excess); out-of-fold false alarms 0.50%"
  },
  "swir1": {
   "ch_bands_nm": [
    1728,
    1762
   ],
   "nh_bands_nm": [
    1510
   ],
   "a": 3.6137328146932295,
   "b": 2.368329199992467,
   "fires_if_excess_above": 10.8,
   "derivation": "below 1800 nm only, for high-resolution scans whose 2000-2100 nm region is too noisy for C1 (check.acquisition fallbacks); least squares on the clean pool; cut set above the real clean tails, not a pool percentile"
  }
 },
 "golden": {
  "spectra_file": "golden_spectra_checks_v1.json",
  "tolerance": {
   "abs": 1e-09,
   "rel": 1e-09
  },
  "cases": [
   {
    "name": "rc_good_positive_all_six",
    "spectrum_sha256": "ea4c88b7008cb8b19f102f52d39d19a2c4a0b1a93cda1f2e30545ecbdd6f407d",
    "inputs": {
     "gate": null,
     "specific_fired": false,
     "tail_unreliable": false,
     "longwave_mode": "truncated"
    },
    "expected": {
     "status": "assessed",
     "excess": 0.9543831825967786,
     "film": 5.583670551573966,
     "film_fired": false,
     "fired": false,
     "gated": false
    }
   },
   {
    "name": "rc_lift_blocked_gated",
    "spectrum_sha256": "653e7e22b860a36605b6605d9c33b4ffb433d00daa49cb1b4e122eaf167fba56",
    "inputs": {
     "gate": "noise in 2000-2100 nm",
     "specific_fired": false,
     "tail_unreliable": false,
     "longwave_mode": "truncated"
    },
    "expected": {
     "status": "gated: noise in 2000-2100 nm",
     "excess": null,
     "film": null,
     "film_fired": null,
     "fired": null,
     "gated": true
    }
   },
   {
    "name": "rc_flag_on_good_wax",
    "spectrum_sha256": "c6e4e1c91a8a53d5d9d2893097c55ff13237f33ef87bdf858d3c8526518a145d",
    "inputs": {
     "gate": null,
     "specific_fired": true,
     "tail_unreliable": false,
     "longwave_mode": "truncated"
    },
    "expected": {
     "status": "skipped: a specific sign fired",
     "excess": null,
     "film": null,
     "film_fired": null,
     "fired": null,
     "gated": false
    }
   },
   {
    "name": "rc_flag_on_unlikely_c1",
    "spectrum_sha256": "3365fdd81606e124862fc4033a2a97798f46abbfb6526b1bed51f869eb98356d",
    "inputs": {
     "gate": null,
     "specific_fired": false,
     "tail_unreliable": false,
     "longwave_mode": "truncated"
    },
    "expected": {
     "status": "assessed",
     "excess": 14.999999999999975,
     "film": 0.43356675811920575,
     "film_fired": false,
     "fired": true,
     "gated": false
    }
   },
   {
    "name": "hires_longwave_not_assessed",
    "spectrum_sha256": "56c8e3dd2b0ab8c31c8fce1bdd3ab62234072b1eca780a5e23a7c957c23dedac",
    "inputs": {
     "gate": null,
     "specific_fired": false,
     "tail_unreliable": false,
     "longwave_mode": "truncated"
    },
    "expected": {
     "status": "assessed",
     "excess": 0.2018070058636532,
     "film": 5.34517798136351,
     "film_fired": false,
     "fired": false,
     "gated": false
    }
   },
   {
    "name": "hires_c1_gated_plaster_checked",
    "spectrum_sha256": "c0a63b6beb83a81e7f5984e3a1f6098c123fa4d25c0235a865ceac8febc080bc",
    "inputs": {
     "gate": "noise in 2000-2100 nm",
     "specific_fired": false,
     "tail_unreliable": false,
     "longwave_mode": "truncated"
    },
    "expected": {
     "status": "gated: noise in 2000-2100 nm",
     "excess": null,
     "film": null,
     "film_fired": null,
     "fired": null,
     "gated": true
    }
   },
   {
    "name": "hires_longwave_300_c1_truncated",
    "spectrum_sha256": "1ac98c845c5ab843695b97f94f663d18b6b666db9c3eac732ed7dda932e59928",
    "inputs": {
     "gate": null,
     "specific_fired": false,
     "tail_unreliable": true,
     "longwave_mode": "truncated"
    },
    "expected": {
     "status": "assessed: truncated (long-wave region too noisy)",
     "excess": 1.0740242498939594,
     "film": null,
     "film_fired": null,
     "fired": false,
     "gated": false
    }
   },
   {
    "name": "hires_longwave_300_c1_truncated [longwave mode not_assessed]",
    "spectrum_sha256": "1ac98c845c5ab843695b97f94f663d18b6b666db9c3eac732ed7dda932e59928",
    "inputs": {
     "gate": null,
     "specific_fired": false,
     "tail_unreliable": true,
     "longwave_mode": "not_assessed"
    },
    "expected": {
     "status": "not assessed: long-wave region too noisy",
     "excess": null,
     "film": null,
     "film_fired": null,
     "fired": null,
     "gated": false
    }
   },
   {
    "name": "hires_fallback_reduced_clean",
    "spectrum_sha256": "6475251e181f9bdb6f20caff0282a53f6b6d95e482a53413a2d0dc6d6f54aeaf",
    "inputs": {
     "gate": "noise in 2000-2100 nm",
     "specific_fired": false,
     "tail_unreliable": false,
     "longwave_mode": "truncated",
     "reduced": "swir1"
    },
    "expected": {
     "status": "assessed: reduced (below 1800 nm only; noise in 2000-2100 nm)",
     "excess": 5.131020609686103,
     "film": null,
     "film_fired": null,
     "fired": false,
     "gated": false
    }
   },
   {
    "name": "hires_fallback_c1_fires",
    "spectrum_sha256": "c044d1589ad0b91399a45af01bd1ec4a63bdacff0e069df72c860c84e5335a8a",
    "inputs": {
     "gate": "noise in 2000-2100 nm",
     "specific_fired": false,
     "tail_unreliable": false,
     "longwave_mode": "truncated",
     "reduced": "swir1"
    },
    "expected": {
     "status": "assessed: reduced (below 1800 nm only; noise in 2000-2100 nm)",
     "excess": 13.904713475123394,
     "film": null,
     "film_fired": null,
     "fired": true,
     "gated": false
    }
   },
   {
    "name": "hires_fallback_plaster_fires",
    "spectrum_sha256": "02439ed695cbef891287f3710a6bdfda5caa5889fa2f9600f8cc20f5a4a4b418",
    "inputs": {
     "gate": null,
     "specific_fired": true,
     "tail_unreliable": false,
     "longwave_mode": "truncated",
     "reduced": "swir1"
    },
    "expected": {
     "status": "skipped: a specific sign fired",
     "excess": null,
     "film": null,
     "film_fired": null,
     "fired": null,
     "gated": false
    }
   },
   {